Crop,Scientific,Stress,Description,Solutions,Causal Organisms,Affected Plant Parts,Affected Plant Stages
Eggplant,Solanum melongena,Flea Beetle's Damage,"Flea beetles are small, jumping insects that can cause damage to eggplants and other plants by feeding on the leaves and stems.     They are typically black or brown in color and are named for their ability to jump like fleas when disturbed.     Flea beetles can cause significant damage to eggplants, especially when populations are high.        Signs of flea beetle damage on eggplants include small holes in the leaves, a ""shot hole"" appearance of the foliage, and wilting or stunted growth.     Flea beetles can also transmit bacterial wilt disease to eggplants, further reducing their health and yield.","There are several control methods available for managing Flea beetle on eggplants, including chemical, biological, and cultural control.    

Cultural Control: One method is to use row covers to physically exclude the beetles from the plants. Another method is to plant eggplants earlier in the season, as flea beetles tend to be more active in late spring and early summer. Additionally, removing any weeds or debris around the plants can also help reduce the population of flea beetles.

Biological Control: Natural enemies of flea beetles include parasitic wasps and predatory insects like ladybugs. One effective biological control method for flea beetles is releasing beneficial nematodes in the soil. These microscopic worms will attack the larvae of the flea beetles, reducing their population.        

Chemical Control: Some common pesticides used to control flea beetles in eggplants include carbaryl, pyrethroids, and neonicotinoids. It is important to follow the instructions on the label and use the appropriate protective equipment while applying the pesticide. However, repeated use of pesticides can lead to the development of resistance in flea beetles and can also harm beneficial insects, such as bees and other pollinators.        ","Insect, Pest",Leaves,Vegetative Stage
Onion,Botrytis squamosa,Botrytis Leaf Blight,"Botrytis leaf blight -  sometimes also referred to as Botrytis leaf spot, occurs on onions.     White, sunken spots on leaves are usually the first sign of infection. Spots are small, oval-shaped, and range from 0.06 to 0.25 inch (0.5Ã¢â‚¬â€œ6 mm) long.     They sometimes have a light-green halo and may appear water-soaked. The epidermis around the spots may be silvery.     When numerous spots are present, leaf tips die back, and whole leaves may eventually die.","There are several control methods available for managing Botrytis leaf blight in onions, including chemical, biological, and cultural control.        

Cultural Control: Botrytis leaf blight, sometimes also referred to as Botrytis leaf spot, occurs on onions.     White, sunken spots on leaves are usually the first sign of infection. Spots are small, oval-shaped, and range from 0.06 to 0.25 inch (0.5Ã¢â‚¬â€œ6 mm) long.     They sometimes have a light-green halo and may appear water-soaked. The epidermis around the spots may be silvery.     When numerous spots are present, leaf tips die back, and whole leaves may eventually die.

Biological Control: Biological control is an environmentally friendly method of managing Botrytis leaf blight in onions.     The use of microbial agents such as Trichoderma spp., Bacillus subtilis, and Pseudomonas fluorescens has been found to be effective in controlling the disease.     These microbial agents work by competing with the pathogen for nutrients and space, and also by producing antimicrobial compounds that inhibit the growth of the pathogen.        

Chemical Control: Copper fungicides: Copper fungicides are a common chemical treatment option for Botrytis Blight.     They disrupt the fungal cell walls and prevent the fungus from growing. Regular Pesticides:     Many effective pesticides against other fungi can also help control Botrytis Blight.    Chlorothalonil: Chlorothalonil is a broad-spectrum fungicide that can prevent and control Botrytis Blight.       ",Fungus,"fruit, leaves, petals, and succulent stems",Fruiting and Vegetative growing stages of the plants
Onion,Spodoptera frugiperda,Armyworm Damage,"Armyworm -  is an early season pest that attacks grass crops like small grains and corn. It is not a common economic pest,     but occasionally can occur in high numbers and cause severe damage to seedlings and whorl stage corn. Armyworm, in field corn,     is always associated with the presence of grassy weeds within fields prior to planting or during the season. Moths will not lay eggs on corn plants but prefer     other grass plants.","There are several control methods available for managing armyworms in onions, including chemical, biological, and cultural control.        

Cultural Control: Adoption of certain cultural practices might be helpful in reducing the impact of this pest. Management of broad leaf weeds and rapid disposal of crop residues after harvest are the most important practices. 

Biological Control: Little is known about the occurrence and importance of natural enemies in Hawaii. Frontina archippivora is known to parasitize the pest, but its impact on control is unknown.

Chemical Control: Hawaiian populations of beet armyworm have been easily controlled with insecticides in contrast to mainland populations. Bacterial insecticides (Bacillus thuringiensis) are more effective today then in the past because of deliberate selection for activity against this pest. In using insecticides, it is very important that users achieve good coverage of targeted plants and make applications when the pest is in early larval stages.","Insect, Pest","seedlings, consume large portions of leaves",Seedling and Vegetative growing stages of the plants
Onion,Phytomyza gymnostoma,Leaf Miners Damage,"Leafminer - Adults have yellow heads, knees, sides of abdomens; otherwise mostly dark gray, just over 1/10 inch long.    Pupae are red-brown, slightly longer than adults.    Larvae are white to yellow, up to about 1/3 inch long.    Eggs are white, about 1/50 inch long, found on leaves.    Adult feeding holes found in rows, with milky white sap coming out.    ","There are several control methods available for managing leaf miners in onions, including chemical, biological, and cultural control.        

Cultural Control: is an effective and environmentally friendly method of managing leaf miners on onions, which involves the adoption of various agricultural practices such as crop rotation, sanitation, mulching, plant spacing, and plant selection to reduce the incidence of the pest, promote crop health, and ultimately increase yield.

Biological Control: is an environmentally friendly method of managing leaf miners in onions. The use of parasitic wasps such as Diglyphus isaea has been found to be effective in controlling the pest. These parasitic wasps work by laying their eggs inside the pest, which leads to its death.        

Chemical Control: Pyrethrin, an organic pesticide, will kill leaf miners as they leave the egg and enter the leaf. Since they have to chew into the leaf, they ingest the poison with the leaf and die. However, pyrethrin also kills good insects such as bees and leaf miner predators. Use to spot-treat concentrations of leaf miners rather than blanket the whole garden. Be sure you get it on the bottom side of the leaf.   ","Insect, Pest",Leaves,Vegetative Stage
Onion,Spodoptera exigua,Beet Armyworm,"Beet armyworm caterpillars exhibit color variations, but they are typically olive green with a yellowish stripe running along each side of their bodies. They often have dark spots above the second pair of actual legs. Their bodies are smooth and mostly devoid of hair. The abdomen has four pairs of prolegs located on segments 3 to 6. Older larvae can reach lengths of up to 1.5 inches. Adult moths deposit their eggs in clusters covered with scales and cottony material on the surface of leaves. During the first and second instar stages, the larvae feed in groups near the egg masses, scraping the leaf surface and skeletonizing the leaves while leaving the veins mostly intact. As they mature, the larvae disperse and start feeding individually, targeting stems and the center of the plant. The population of beet armyworms tends to increase as the weather becomes warmer, and they are commonly found in late summer and fall crops.","To control Beet Armyworm on onions, there are several methods that can be used, including chemical control, biological control, and cultural control.    

Cultural Control: To minimize the spread of insects from weeds in your garden, it is advisable to eliminate their preferred weeds if they are present nearby. Regularly inspect your vegetable patch throughout the growing season, remove any affected foliage, or manually destroy eggs and larvae upon detection. After harvesting, it is recommended to cultivate the soil to expose and eliminate any prepupae and pupae present in the ground. For protection against moth infestation, consider employing exclusion techniques such as using floating row covers to prevent moths from laying eggs on your plants. However, it is crucial to note that this method is most effective if your garden has yet to experience previous infestations and if no pupae are in the soil, ready to hatch beneath the rows.

Biological Control: To naturally control pest populations, you can attract or purchase natural enemies that help reduce their numbers. The effectiveness of these methods may vary depending on your location and the crops you are growing. Predators like minute pirate bugs, big-eyed bugs, damselflies, and predatory stink bugs actively hunt and prey on the eggs and small larvae of these pests. Parasitoid wasps, such as Chelonus insularis and Meteorus autographae, lay their eggs inside the larvae, while Lespesia archippivora, a small tachinid fly, also targets the larvae.
Specific fungal pathogens, including Erynia and Metarhizium rileyi (syn. Nomurea rileyi), can infect and kill off some of the larvae before they cause significant damage to your vegetables. For controlling the pupal stage in the soil, beneficial nematodes like Steinonerma and Heterorhabditis species can be effective. They infect and control the beet armyworms during their prepupal and pupal stages.

Chemical Control: Pests exhibiting pesticide resistance pose a significant challenge for gardeners and farmers. The beet armyworm is no exception to this problem. To avoid promoting resistance, exploring alternative pest control methods is advisable, as mentioned. In cases where chemical intervention is necessary, pyrethroids like Sevin, can be effective against beet armyworms if applied correctly and at the appropriate time. However, it's important to exercise caution when using chemicals, as they can harm beneficial insects, pollinators, and aquatic life.
source: https://gardenerspath.com/how-to/disease-and-pests/control-beet-armyworms/","Insect, Pest",Leaves,"Seedling Stage, Vegetative Stage, Flowering Stage, Fruit Development Stage"
Tomato,Alternaria alternata,Black Mold,"Black mold on tomato plants is typically caused by a fungal infection, commonly known as ""black mold"" or ""black spot."" The fungus responsible for this condition is called Alternaria solani.     Symptoms of black mold on tomato plants may include black or brownish lesions or spots on leaves, stems, and fruit. These spots may be circular or irregular in shape, and may be raised or sunken.     The infected tissue may become dry and papery, and may eventually crack or crumble. As the infection progresses, the leaves may yellow and die, and the fruit may become distorted or mummified.     In severe cases, the plant may become stunted and eventually die. Black mold on tomatoes can spread rapidly under warm and humid conditions, making it important to control the infection as soon as it is detected.    ","To control Black Mold on tomato, there are several methods that can be used, including chemical control, biological control, and cultural control.    

Cultural control: Reducing insect infestations, as insects such as aphids and whiteflies secrete a sticky substance called honeydew, which can promote the growth of black mold. Washing off the honeydew and black mold with a strong stream of water. Pruning infected branches or leaves and disposing of them in the trash. Using reflective mulches or coatings, such as kaolin clay, which can reduce the incidence of black mold by reflecting sunlight and reducing leaf surface temperatures.    

Biological control: One effective method is to apply a biofungicide containing Bacillus subtilis, a beneficial bacterium that can prevent black mold from spreading. Another option is to use predatory mites, such as Phytoseiulus persimilis or Neoseiulus californicus, which feed on black mold and other plant pests.         

Chemical control: There are several fungicides available that can control black mold on tomato plants, including copper fungicides, sulfur fungicides, and fungicides containing triadimefon or myclobutanil. Follow the instructions on the fungicide label carefully, as overuse or misuse can lead to plant damage or residue on the tomatoes. Avoid applying fungicides during the hottest part of the day or when the plants are water-stressed.",Fungus,Leaves,Vegetative Stage
Tomato,Fusarium oxysporum,Fusarium Wilt,"Fusarium wilt is a common fungal disease that affects tomato plants. The disease is caused by the fungus Fusarium oxysporum and can be devastating to tomato crops.     Symptoms of fusarium wilt on tomato plants usually begin with yellowing and wilting of the lower leaves, which may appear to be scattered throughout the plant. The yellowing may progress to the entire plant, causing it to wilt and eventually die.        The fungus can survive in the soil for several years, making crop rotation an important management strategy. Fusarium wilt can also be transmitted through infected seeds, transplants, and soil. The fungus invades the roots of the tomato plant, interfering with the uptake of water and nutrients, which can lead to wilting and eventual death.    ","To control Fusarium Wilt on tomato, there are several methods that can be used, including chemical control, biological control, and cultural control.    

Cultural control: Planting resistant tomato varieties that are less susceptible to fusarium wilt. Rotating crops, as the fungus can survive in the soil for several years and infect future tomato crops. Removing and destroying infected plants and any plant debris that can harbor the fungus. Avoiding overwatering and watering at the base of the plants rather than overhead watering, which can promote fungal growth. Using sterilized soil or soilless growing media to start seedlings. Applying organic matter, such as compost, to the soil to promote a healthy microbial community.    

Biological control: One effective method is to use soil-borne beneficial microorganisms, such as Trichoderma spp. or Bacillus subtilis, which can suppress the growth of the fungus that causes fusarium wilt. Another option is to use soil solarization, a process that involves covering the soil with plastic to trap heat and kill the fungus.         

Chemical control: There are no chemicals available to cure fusarium wilt, but some fungicides can help reduce the severity of the disease. Fungicides containing chlorothalonil, mancozeb, or copper can help protect plants from fungal infections. Follow the instructions on the fungicide label carefully, as overuse or misuse can lead to plant damage or residue on the tomatoes.         ",Fungus,"Leaves, stem, and roots",Seedling and vegetative growing stages of the plants
Tomato,"Tuta absoluta
Lyriomyza spp.",Leaf Miner,"Leaf miner is a common pest that affects tomato plants, as well as many other plants. The pest is a small, flying insect that lays eggs on the surface of the tomato plant leaves. When the eggs hatch, the larvae tunnel into the leaves, creating winding, white or yellowish-brown tracks or tunnels. These tunnels can cause significant damage to the leaves, interfering with the plant's ability to photosynthesize and produce healthy fruit.        In addition to the visible tunnels, leaf miner damage can cause the leaves to become distorted or curled, which can further impact the plant's health. Severe infestations can result in stunted growth and reduced yield. Leaf miners typically thrive in warm, humid conditions, and can be difficult to control once established.    ","To control Leaf Miner on tomato, there are several methods that can be used, including chemical control, biological control, and cultural control.    

Cultural control: Removing and destroying any infected leaves or plant debris that can harbor the insects. Using reflective mulches or coatings, such as aluminum foil or silver plastic, which can confuse the leaf miners and reduce their attraction to the plants. Using yellow sticky traps, which can attract and trap adult leaf miner flies. Planting resistant tomato varieties that are less susceptible to leaf miners.

Biological control: Biological control involves the use of natural enemies to control leaf miners. One effective method is to release parasitic wasps, such as Diglyphus spp. or Chrysocharis spp., which lay their eggs in the leaf miner larvae, killing them. Another option is to use predatory mites, such as Phytoseiulus persimilis or Neoseiulus californicus, which feed on leaf miners and other plant pests.         

Chemical control: There are several insecticides available that can control leaf miners on tomato plants, including spinosad, abamectin, and cyromazine. Follow the instructions on the insecticide label carefully, as overuse or misuse can lead to plant damage or residue on the tomatoes. Avoid applying insecticides during the hottest part of the day or when the plants are water-stressed.","Insect, Pest",Leaves,Vegetative Stage
